Type;Udbudsform;Energimærke;Varmekilde;Byggeår;Rum;Bad;Toilet;Boligareal;Garage;Grundareal;Kontantpris;Ejerudgift;address;description;zip code;Ombygget;Kælder;Carport;Plan;Udhus;Disp. rum;Fritliggende overdækning;Anneks;Udestue;210;Orangeri;Lager;Lysthus;Drivhus;Bygning til lager;Etage;Overdækket areal;Ukendt bygning;Overdækning;overdækning;Erhverv;Bygning til detailhandel;Tiloversbleven landbrugsbygning;Værksted;Skur;Gammel mølle - bygning til fritidsformål;Ukendt;Fritliggende enfamiliehus;Fritliggende udestue;Overdækket terrasse;Bygning til industri uden integreret produktionsapparat;Nørrebro 8B, stuen Værksted ;Unnamed: 48;Anden bygning til landbrug mv.;Maskinhus, garage mv.;Pejsestue;Anneks i tilknytning til helårsbolig.;Lade til halm, hø mv.;Garage/udhus;Overdækkede arealer;Hønsehus;Carport/Udhus ;Legehus;Drivhus 2;Brændeskur;Bygning til kontor;Lade til foder, afgrøder mv.;Hundehus;Altan;Carport/Udhus;Voliere;Cykelskur;Udhus/stald;Væksthus;Hal/værksted mv.;Seniorhus;Swimming pool;Dobbelthus;hobbyrum/indbygget udhus;stue/udestue;Anneks med erhvervsstatus;Vindfang;overdækket areal;garage/udhus;værksted;maskinhus, garage mv.;Stald til svin;Bageri lokale;Bolig;Carport/udhus;Anden bygning til helårsbeboelse;Værksted/erhverv;Beboelse;garage;Carport/skur;Overdækket terrasse ;Erhverv - Værksted/Lade bygning;Erhvervsareal;Stald til kvæg, får mv.;Kælder under garage;Erhvervsdel;Udhus (gildesal);Indendørs swimmingpool rum;Garage i kælder;Udhus og garage;Maskinhus;Havepavillion;Erhverv. Heraf er 30m² udhus inkluderet.;Værksted/udhus;Anden bygning til institutionsformål;Fordelingstal:   238/710;Bygning til parkering af flere end to køretøjer i tilknytning til boliger;Lagerbygning;Bygning til parkering- og transportanlæg;Brændehus;Overdækning/brændeskur;Vaskehus;Fyrrum;Udhus med indbygget carport;Garage med indbygget udhus på 62 kvm;udhus med indbygget carport på 21 kvm;Uudmyttet loftsrum;Overdækket arealt;Lade/garage;Stald;Kælder i maskinhus;Erhvervsareal/udhuse;Sommerhus;Anden bygning til fritidsformål;Badeværelse i kælder godkendt til beboelse;Redskabsrum;Overdækket indgangsparti;Privat servicevirksomhed som frisør, vaskeri, netcafé mv.;Fællesrum i bygning 2 (værksted) ;Udhus/Værksted;Overdækket areal ;Lysthus (ikke registreret på BBR);Garage (ikke registreret på BBR);Stald til fjerkræ;Garage/Værksted;Lejlighed;Fritliggende udhus;Minkhal;Butiks/kontorlokale;Leje pr. md.;Depositum;Andel fælleshus;Overdækket terrasse jf. fælles BBR;Parkeringspergola;depot;Depot i kælder;Depotrum i kælder;Fælles trappeareal;pulterrum;kælder;Kælderrum;altan;Altan ;Kælderum ;Pulterrum;depotrum;Altan på ca. 6m2;kælderrum;altan/tagterrasse;tagterrasse;Pulterrum i kælder;Loftrum;Depotrum ;Depotrum;Loftværelse ;Loftsrum;Strygestue;Skabsrum;Viktuolierum;Pulterrum på loftet;Altan/terrasse;fælles adgangsareal;tagetage;areal af åben altan/tagterrasse;balkonareal;altan/terrasse;udestue;Areal af åben/tagterrasse;Andel i fællesareal;hems og loftrum;Købspris;Teknisk Pris;Ydelse;Overdækket altan;Udestue ;Lade;"Maskinhus&nbsp;";Staldbygning;Lade og garage;Hestestald;Ridehal;(UDFASES) Bygning til erhvervsmæssig produktion vedrørende landbrug, gartneri, råstofudvinding o. lign;Bygning til erhvervsmæssig produktion vedrørende landbrug, gartneri;Bygning til træning og opstaldning af heste;"Stald&nbsp;";anden villa;Maskinhus,  garage mv.;Bed & breakfast bygning;Erhverv - Anden bygning til landbrug mv.;Erhverv - Lade til foder, afgrøder mv.;Bygning til erhvervsmæssig produktion vedrørende landbrug, gartneri, råstofudvinding o. lign;Landbrugsbygning;Svinestald;staldbygning;maskinhus;Udhuse;Pavillon;Andre bygninger til landbrug mv.;Anden bygning til serviceerhverv;Bygning til erhvervsmæssig produktion;Bygning til erhvervsmæssig produktion i;Anden bygning til produktion;Bygning til erhvervsmæssig produktion vedrørende industri, håndværk m.v. (fabrik, værksted o.lign.);(UDFASES) Bygning til erhvervsmæssig produktion vedrørende landbrug,;Garage (med plads til et eller to køretøjer);øvrige arealer;Anden bygning til transport, handel etc;Værksted 109 m2 + 3 vær. til bolig 94 m2;Brugsret kælderrum;City;Road;Road1;full_address;latitude;longitude
Villa;Salg;A2020;Varmepumpe;2019.0;6.0;2.0;2.0;190.0;55.0;1.006;4.945.000;3.481;Jens Ussings Vej 4, Grejs 7100 Vejle;Glæd jer til at opleve denne fantastiske etplansvilla fra 2019 beliggende på en lukket vej i det naturskønne område, Grejs. I bliver mødt af en særdeles velindrettet bolig med hele fire værelser og to badeværelser, som giver jer gode muligheder for at skabe en børne- og voksenafdeling. Hertil byder boligen blandt meget andet på et stort, lyst køkken/alrum og en dejlig stue med store vinduer ud mod haven, som også her sikrer et flot lysindfald. I hele boligen kan I nyde gulvvarmen, der også er at finde i den store, integrerede dobbeltgarage.Det store køkken/alrum, der blandt andet består af et flot og lyst køkken fra HTH, byder på masser af bordplads og lægger op til samvær med familien om madlavning, lektielæsning og mange gode stunder. Det praktiske viktualierum giver god mulighed for opbevaring, og så giver nichen i køkkenet utallige muligheder for skrivebordsplads, læsehjørne eller noget helt tredje, alt efter hvad I har behov for. Køkken/alrummet og stuen forbindes af charmerende, franske døre, og så er der fra både alrummet og stuen adgang til terrassemiljøet og haven.Den lukkede have kombinerer perfekt ønsket om en have med nemt vedligehold og muligheden for at skabe hyggelige områder i både haven og på terrassen med krukker med buske og blomster. Den store terrasse er delvist overdækket, og I har derfor mulighed for at nyde både terrassen og haven i al slags vejr.Den dobbelte garage byder, ud over plads til familiens biler, også på både opbevaringsplads og et værkstedsbord langs væggen, der skjules bag skydelåger. Hertil er der omkring 2021 opført et skur. Indkørslen til boligen fuldendes af en elegant, fjernbetjent smedejernsport der fører op til jeres kommende hjem.Skove, flotte stisystemer og søer findes flere steder nær boligen, hvorfor det ikke hører til sjældenheder, at harer, ænder og andre dyr lægger vejen forbi haven. Beliggenheden kombinerer på fornemste vis nærheden til den flotte natur i området med nærheden til både skole, daginstitution og den lokale købmand. Herudover er Vejle centrum en kort køretur væk, og motorvejsnettet tilgås også nemt fra beliggenheden. I får altså alt, hvad der er brug for indenfor kort afstand med denne fantastiske bolig.;7100;;;;;;;;;;;;;;;;;;;;;;;;;;;;;;;;;;;;;;;;;;;;;;;;;;;;;;;;;;;;;;;;;;;;;;;;;;;;;;;;;;;;;;;;;;;;;;;;;;;;;;;;;;;;;;;;;;;;;;;;;;;;;;;;;;;;;;;;;;;;;;;;;;;;;;;;;;;;;;;;;;;;;;;;;;;;;;;;;;;;;;;;;;;;;;;;;;;;;;;;;;;;;Vejle;Jens Ussings Vej 4, Grejs;Jens Ussings Vej 4;Jens Ussings Vej 4 Vejle;55.766191;9.541604
Villa;Salg;D;Fjernvarme;1957.0;5.0;1.0;3.0;187.0;;1.405;3.995.000;3.31;Bøgeparken 12 7100 Vejle;Tæt på hverdagens behov samt skov og med nem adgang til motorvej kan I nu blive de nye ejere af denne moderne og indbydende villa i Vinding, der fordeler sig over stueplan og en yderst anvendelig underetage. Glæd jer til at se et åbent opholdsmiljø, tre værelser, et kontor, et badeværelse, to gæstetoiletter, et bryggers og to gode, disponible rum. Hertil kommer en dobbelt carport og en vidunderlig have.Køkken/alrum og stue udgør opholdsmiljøet, og lyset strømmer ind takket være markante vinduespartier, som forbinder jer med terrassen. Invita-køkkenet er fra 2019 og fremstår lækkert og moderne med induktionskogeplade og armatur i messing. Videre udfolder stuen sig, hvor langbordet og sofaafdelingen indrettes.Hjemmet er udført i forskudte plan, så der er ét værelse ved entréen, mens yderligere to er et niveau højere oppe. Der er indbyggede skabe, og her er også et walk-in-closet samt et badeværelse med brus, badekar og gulvvarme. Underetagen er renoveret i 2021 og byder på to anvendelige, disponible rum, et gæstetoilet og et bryggers.Den fantastiske have er omkranset af gamle bøgetræer og opvoksede rhododendronbuske, som blomstrer smukt i forskellige farver. Udearelaet er helt lukket og privat, og så vender det sammen med terrasserne perfekt i forhold til solens bane. Netop terrasserne kan arrangeres med havesættet og grillen, så I kan nyde de varme dage under åben himmel.I bosætter jer på et lukket, børnevenligt vænge med kort afstand til skole, dagtilbud, indkøb og Vinding Idræts Center. I kan også hurtigt cykle til skoven og til vandet ved Vejle Fjord. Vejle centrum ligger knap fire kilometer væk og byder blandt andet på hyggelige spisesteder og caféer. Endelig møder I motorvejen efter få minutter bag rattet.;7100;1968.0;70.0;39.0;;;;;;;;;;;;;;;;;;;;;;;;;;;;;;;;;;;;;;;;;;;;;;;;;;;;;;;;;;;;;;;;;;;;;;;;;;;;;;;;;;;;;;;;;;;;;;;;;;;;;;;;;;;;;;;;;;;;;;;;;;;;;;;;;;;;;;;;;;;;;;;;;;;;;;;;;;;;;;;;;;;;;;;;;;;;;;;;;;;;;;;;;;;;;;;;;;;;;;;;;;Vejle;Bøgeparken 12;Bøgeparken 12;Bøgeparken 12 Vejle;55.682778;9.561087
Villa;Salg;C;Naturgas;1976.0;4.0;2.0;2.0;146.0;;930;3.495.000;2.979;Banevang 22, Mølholm 7100 Vejle;Med nøgleord som grønne omgivelser, lækkert lysindfald og en naturskøn udsigt over skoven får I gode rammer i denne villa i Vejle. Her venter to badeværelser, et stort opholdsmiljø samt en separat voksenafdeling og børneafdeling, der sikrer jer både privatliv og samvær. Oveni har boligen et tag fra 2021 samt gulvvarme på badeværelserne og i underetagen. Endelig er beliggenheden pragtfuld nær hverdagens gøremål og naturen.Boligens hjerterum er det store opholdsmiljø med åben forbindelse mellem stue og køkken/alrum, hvilket skaber en let og luftig rumfornemmelse, som forstærkes af den flotte loftshøjde og det skønne lysindfald. Oveni er der en hyggelig Hwam-brændeovn fra 2014, som bliver omdrejningspunktet på kølige dage. Desuden har stuen en smuk udsigt til naturen og broen i horisonten.Oveni gør indretningen det muligt at prioritere samvær på tværs af madlavning og forskellige aktiviteter. Det elegante Invita-køkken fra 2015 byder på en ovn i ergonomisk højde, god opbevaringsplads samt bordplader i stål og naturoliebehandlet egetræ, så I får gode rammer om madlavningen. Her kan I tilberede middag og samtidig deltage i snakken omkring spisebordet.Udenfor kan I se frem til en frodig, skrånende grund, som bliver et markant trækplaster i sommerhalvåret. Det store terrassemiljø indbyder til frokost under åben himmel, mens det hyggelige orangeri gør det muligt at nyde udelivet i læ for sol og regn. Oveni har terrassen en indbygget køkkenhave med højbede. Som bonus er der et brændeskur med værksted og et isoleret træhus med el.I får en rolig beliggenhed for enden af en blind vej, som på bedste vis forener grønne områder med hverdagens gøremål. Her får I skoven lige udenfor døren, ligesom I kan glæde jer over en smuk udsigt til fjorden. Der er gåafstand til Vejle Fjord, indkøb og busstoppested, mens skole, daginstitution og sportsfaciliteter er en cykeltur væk. Endelig fører cyklen jer også hurtigt til centrum;7100;;65.0;;2.0;18.0;;;;;;;;;;;;;;;;;;;;;;;;;;;;;;;;;;;;;;;;;;;;;;;;;;;;;;;;;;;;;;;;;;;;;;;;;;;;;;;;;;;;;;;;;;;;;;;;;;;;;;;;;;;;;;;;;;;;;;;;;;;;;;;;;;;;;;;;;;;;;;;;;;;;;;;;;;;;;;;;;;;;;;;;;;;;;;;;;;;;;;;;;;;;;;;;;;;;;;;;Vejle;Banevang 22, Mølholm;Banevang 22;Banevang 22 Vejle;55.699203;9.546171
Villa;Salg;C;Fjernvarme;1878.0;5.0;1.0;2.0;143.0;;391;7.395.000;3.242;Staldgaardsgade 19, Vejle Centrum 7100 Vejle;På en central og attraktiv placering i Vejle møder I denne fornemt istandsatte villa, der ikke alene fremstår med et stort æstetisk overskud, men også byder på masser af plads på tværs tre etager. Planløsningen er velkomponeret med plads til både privatbolig og erhverv, og ude venter jer en dejlig, solrig gårdhave.;7100;1984.0;;;;;69.0;;;;;;;;;;;;;;;;;;;;;;;;;;;;;;;;;;;;;;;;;;;;;;;;;;;;;;;;;;;;;;;;;;;;;;;;;;;;;;;;;;;;;;;;;;;;;;;;;;;;;;;;;;;;;;;;;;;;;;;;;;;;;;;;;;;;;;;;;;;;;;;;;;;;;;;;;;;;;;;;;;;;;;;;;;;;;;;;;;;;;;;;;;;;;;;;;;;;;;;Vejle;Staldgaardsgade 19, Vejle Centrum;Staldgaardsgade 19;Staldgaardsgade 19 Vejle;55.712654;9.535063
Villa;Salg;C;Fjernvarme;1927.0;4.0;2.0;2.0;150.0;28.0;617;2.195.000;2.921;Mågevej 17, Mølholm 7100 Vejle;Velkommen til Mågevej 17 i Mølholm, Vejle – en charmerende bolig med en fantastisk beliggenhed tæt på skov, fjorden og naturskønne områder. Denne to-etagers bolig strækker sig over 150 kvm og byder på en komfortabel og rummelig atmosfære. Når du træder ind i boligen, vil du straks føle dens historie og charme. Bygget tilbage i 1927 og renoveret i 1999 er denne ejendom en harmonisk blanding af klassisk arkitektur og moderne bekvemmeligheder. Renoveringen sikrer, at boligen opfylder moderne standarder og har opdaterede faciliteter. Boligen byder blandt andet på et dejligt køkken-alrum i åben forbindelse med stuen og tre værelser, der giver masser af plads til familie, gæster eller kontorplads. Der er også to badeværelser, hvilket øger bekvemmeligheden og gør det nemt at imødekomme familiens behov. Ud over hovedbygningen har ejendommen også et 10 kvm udhus, som kan bruges som opbevaringsrum eller et ekstra arbejdsområde efter behov. Derudover er det endnu et udhus på 28 kvm med mulighed for at skabe et værksted, hobbyrum eller fitnessområde. Opvarmningen af boligen sker med fjernvarme, hvilket sikrer en energieffektiv og bæredygtig opvarmningskilde. Den centrale placering i Vejle betyder, at du har nem adgang til byens faciliteter, herunder butikker, restauranter og offentlig transport. Samtidig giver den nærliggende skov, fjord og naturskønne områder dig mulighed for at nyde naturen og udendørsaktiviteter stort set på dit eget dørtrin. Alt i alt tilbyder Mågevej 17 en vidunderlig kombination af historisk charme, moderne bekvemmeligheder og en fantastisk beliggenhed.;7100;1999.0;;;2.0;10.0;;;;;;;;;;;;;;;;;;;;;;;;;;;;;;;;;;;;;;;;;;;;;;;;;;;;;;;;;;;;;;;;;;;;;;;;;;;;;;;;;;;;;;;;;;;;;;;;;;;;;;;;;;;;;;;;;;;;;;;;;;;;;;;;;;;;;;;;;;;;;;;;;;;;;;;;;;;;;;;;;;;;;;;;;;;;;;;;;;;;;;;;;;;;;;;;;;;;;;;;Vejle;Mågevej 17, Mølholm;Mågevej 17;Mågevej 17 Vejle;55.700245;9.545488
Villa;Salg;A2015;Fjernvarme/blokvarme;2020.0;6.0;2.0;2.0;205.0;;978;4.995.000;3.809;Vindinghave 20 7100 Vejle;I får nu muligheden for at overtage denne arkitekttegnede, fuldmurede udsigtsvilla i Vinding, som er opført i de smukke omgivelser. I får udsigt til både sø, eng og skov og er samtidig tæt på alle hverdagens nødvendigheder. Villaen byder blandt andet på fire gode værelser, to badeværelser, et køkken/alrum i åben forbindelse, en stue samt et bryggers. Ude venter jer en have og et dejligt terrassemiljø med udsigt over området.Køkken/alrummet på hele 43 kvm byder ind med et fantastisk lysindfald og en skøn udsigt, der kan nydes gennem de store vinduespartier. Køkkenet er stilrent med hvide, grebsfrie elementer. Herudover er der en stue med indbygget reol med alkove, der giver mange muligheder for både opbevaring og afslapning.Alle fire værelser tilgås nemt fra den rummelige gang, der ligeledes er yderst anvendelig med blandt andet garderobeplads og skrivebordsplads, der giver mange muligheder for blandt andet hjemmekontor og lektielæsning. Der er herudover mulighed for at åbne op til værelserne og skabe fornemmelsen af et multirum. Begge badeværelser er udført i tidsløse materialer og på det ene findes en dobbelt bruser. På begge badeværelser, i bryggerset, ved alkoven i stuen, ved entreen og ved garderobeområdet er der ovenlysvinduer, der sikrer et flot lysindfald.I kan glæde jer til at opleve udeareralerne omkring denne villa, som består af et dejligt, sydvendt terrassemiljø, hvoraf dele er overdækket. Herfra kan i nyde en smuk udsigt over søen og området, mens i også kan følge solens bane gennem dagen. Haven byder også ind med en køkkenhave, der giver jer mulighed for at forsyne jer selv med diverse grøntsager og frugter.Med denne adresse får i en meget rolig beliggenhed i et attraktivt område i Vinding ikke langt fra byens pulserende liv. I får gåafstand til daginstitution og busstoppesteder, ligesom skole, idrætshal, indkøbsmuligheder og skov heller ikke er langt herfra. Dertil er motorvejen også nem at tilgå.;7100;;;40.0;1.0;20.0;;;;;;;;;;;;;;;;;;;;;;;;;;;;;;;;;;;;;;;;;;;;;;;;;;;;;;;;;;;;;;;;;;;;;;;;;;;;;;;;;;;;;;;;;;;;;;;;;;;;;;;;;;;;;;;;;;;;;;;;;;;;;;;;;;;;;;;;;;;;;;;;;;;;;;;;;;;;;;;;;;;;;;;;;;;;;;;;;;;;;;;;;;;;;;;;;;;;;;;;Vejle;Vindinghave 20;Vindinghave 20;Vindinghave 20 Vejle;55.666628;9.581329
Villa;Salg;C;Fjernvarme;1962.0;4.0;2.0;2.0;155.0;28.0;861;3.085.000;2.768;Violvej 36, Søndermarken 7100 Vejle;Velkommen til denne skønne bolig på Violvej! Her venter en rummelig og velrenoveret bolig på 155 kvm, der byder på moderne bekvemmeligheder og plads til hele familien. Boligens hjerte er den store opholdsstue, hvor der er rigeligt med plads til at slappe af, lege og hyggesig sammen.Den gode planløsning giver mulighed for en fleksibel indretning og skaber udoverbehageligt samlingspunkt for familiens aktiviteter også fine muligheder for lidt privatliv. Det moderne køkken fra HTH er i 2017 renoveret og byder på alt, hvad den madglade familie kanønske sig. Her kan I tilberede lækre måltider og nyde samværet, da køkkenet er i tæt forbindelse tilspise- og tv-stuen.Udenfor venter en dejlig overdækket terrasse, der inviterer til hyggelige stunder i frisk luft, uansetvejrforholdene. Den lukkede have giver privatliv og mulighed for børnenes leg og sjov. Boligen byder desuden på to lækre badeværelser fra HTH, der i 2017 er stilfuldt renoveret, samt trekomfortable værelser, der giver god plads til hele familien.Et praktisk bryggers i forlængelse afkøkkenet giver yderligere funktionalitet i hverdagen. Med let adgang til Søndermarksskolen via en tunnel ved enden af vejen, er denne bolig ideel forfamilier med børn. Fra beliggenheden kan i nyde roen, og samtidig være i gåafstand til alle hverdagensgøremål som skole, daginstitution, sportshal og indkøbsmuligheder. Dette er en bolig, der vil få jer til at føle jer hjemme fra dag ét. Tøv ikke med at kontakte os for enfremvisning, og oplev alle de fantastiske muligheder, denne bolig har at tilbyde. Velkommen tildrømmehjemmet på Violvej!;7100;1974.0;;;;;;39.0;;;;;;;;;;;;;;;;;;;;;;;;;;;;;;;;;;;;;;;;;;;;;;;;;;;;;;;;;;;;;;;;;;;;;;;;;;;;;;;;;;;;;;;;;;;;;;;;;;;;;;;;;;;;;;;;;;;;;;;;;;;;;;;;;;;;;;;;;;;;;;;;;;;;;;;;;;;;;;;;;;;;;;;;;;;;;;;;;;;;;;;;;;;;;;;;;;;;;;Vejle;Violvej 36, Søndermarken;Violvej 36;Violvej 36 Vejle;55.694327;9.516251
Villa;Salg;A2010;Varmepumpe;2007.0;6.0;2.0;3.0;170.0;;620;6.665.000;2.782;Dornsvej 7, Mølholm 7100 Vejle;Denne ekstraordinære villa fra 2007 er spækket med charmerende detaljer og materialer af høj kvalitet og er yderst velplaceret med udsigt over fjord og skov i Mølholm. Villaen præsenterer sig som et udsøgt bygningsværk i palæstil med hvide sprossevinduer, sortglaseret tegltag og kobber-tagrender og står ophøjet i det kuperede, naturskønne terræn. Omkring huset ses indbydende terrassemiljøer, og haven er frodig og fuldkommen lukket.Den gennemførte kvalitet ses blandt andet i valget af materialer, hvor der ikke er gået på kompromis. Heriblandt kan nævnes massivt sildebensparket i alle rum, store sprossevinduer, ovale vinduer over og i hoveddøren, kobbertagrender og et udendørsmiljø med terrasser af ipé, hvor der er taget højde for både sol- og vindforhold. Bygningsløsningerne og kvalitetsmaterialerne er blandt andet valgt med henblik på at sikre lang holdbarhed.Stuen og køkkenet er forenet og udgør således et sammenhængende opholdsrum der breder sig over det meste af stueetagen. Dette store rum er indrettet med et elegant snedkerkøkken, der passer perfekt til husets æstetik. Sollyset strømmer i dette rum ind gennem de mange sprossevinduer, hvorigennem udsigten over naturen, vandet og det livlige havnemiljø kan nydes. Foruden køkken og stue byder stueetagen også på et ualmindeligt skønt værelse med glaspartier hele vejen rundt samt et gæstetoilet.På førstesalen venter jer yderligere tre værelser samt et stort badeværelse med dobbelt brus. Fra den rummelige repos på førstesalen er der adgang til en altan, der orienterer sig i retning af fjorden.Endelig venter jer en kælderetage med tre disponible rum, som byder på uendelig mange muligheder for anvendelse. Her er blandt andet mulighed for træningsrum, opbevaringsplads, multirum samt diverse fester og fejringer, hvor den overdækkede terrasse, der ligger i forlængelse af kælderen, også vil være et stort aktiv. Yderligere finder I et ekstra badeværelse og et mindre køkken.Den fantastiske udsigt kommer til sin ret fra de mange terrasser, og villaens beliggenheden er eminent med nærhed til både naturen i Mølholm og Vejle Centrum, hvor udvalget af indkøbsmuligheder og kulturelle aktiviteter er mange. Herudover ligger Mølholm skole i gåafstand fra matriklen.;7100;;83.0;;2.0;;;;;;;;;;;;;;;;;;;;;;;;;;;;;;;;;;;;;;;;;;;;;;;;;;;;;;;;;;;;;;;;;;;;;;;;;;;;;;;;;;;;;;;;;;;;;;;;;;;;;;;;;;;;;;;;;;;;;;;;;;;;;;;;;;;;;;;;;;;;;;;;;;;;;;;;;;;;;;;;;;;;;;;;;;;;;;;;;;;;;;;;;;;;;;;;;;;;;;;;;Vejle;Dornsvej 7, Mølholm;Dornsvej 7;Dornsvej 7 Vejle;55.698051;9.554717
Villa;Salg;A2010;Fjernvarme;1978.0;5.0;2.0;2.0;158.0;;995;2.995.000;3.099;Prins Buris Vej 17, Vinding 7100 Vejle;Villaen på Prins Buris Vej 17 i Vinding indeholder 158 kvadratmeter, der alle ligger i ét plan fordelt på et køkken/alrum, en stue, fire værelser, to badeværelser og et bryggers. Udendørs på den 995 kvadratmeter store grund er der både græsplæne, fliseterrasser og en dobbelt carport.Der er plads til at samles i de pæne fællesrum, der består af et køkken/alrum og en rummelig stue. Køkkenet er med hvide skabselementer, hvor arbejdsstationerne har en god belysning fra loftets indbyggede spots. Spisebordet kan stå tæt ved køkkenet, mens de bløde møbler bør indrettes i stuen, der som resten af hjemmet er karakteriseret ved et flot gulv og synlige bjælker i loftet.De fire værelser falder i to afdelinger med tre værelser og et badeværelse i det ene afsnit. Værelserne har gode skabsløsninger installeret og et pænt lysindfald. Det resterende værelse har egen adgang til et badeværelse med brus og vil af mange opfattes som en oplagt forældresuite.Haven er velanlagt med flere herlige opholdskroge. Således kan I for eksempel nyde solen fra den store terrasse, hvor en halv overdækning også gør det muligt at sidde i skygge. Resten af haven er nydelig med græsplæne, en sprudlende beplantning, og fortil på grunden har I en dobbelt carport.Villaen ligger for enden af en rolig vej i det familievenlige Vinding, hvor lukkede stisystemer trygt kan føre jer til hverdagens gøremål. Området er præget af den flotte natur omkring skoven, der gør jeres kommende hjemby til et udsøgt sted. Fra matriklen får I fordelagtige afstande til børnehave, indkøbsmuligheder og skole;7100;;;52.0;;;;;;;;;;;;;;;;;;;;;;;;;;;;;;;;;;;;;;;;;;;;;;;;;;;;;;;;;;;;;;;;;;;;;;;;;;;;;;;;;;;;;;;;;;;;;;;;;;;;;;;;;;;;;;;;;;;;;;;;;;;;;;;;;;;;;;;;;;;;;;;;;;;;;;;;;;;;;;;;;;;;;;;;;;;;;;;;;;;;;;;;;;;;;;;;;;;;;;;;;;Vejle;Prins Buris Vej 17, Vinding;Prins Buris Vej 17;Prins Buris Vej 17 Vejle;55.681276;9.54568
Villa;Salg;D;Naturgas;1964.0;5.0;2.0;2.0;154.0;;700;2.595.000;2.516;Merkurvej 13, Uhrhøj 7100 Vejle;Denne etplansvilla på Uhrhøj har en dejlig gårdhave og en ideel planløsning, ligesom I er tæt på alt, hvad dagligdagen finder bekvemt. Indenfor venter et hjem med fire værelser, en stor stue i åben forbindelse med et køkken samt en udestue fra 2018. Derudover er der to badeværelser og et bryggers. I gårdhaven er der sol hele dagen, og haven er nem. I får også et anneks, som ligger særskilt fra boligen.   Det store opholdsrum tæller både dagligstue, spisestue og køkken, da alle tre er forbundet på fineste vis. Her falder et smukt lysindfald ind gennem de store vinduespartier, og der er rigeligt med indretningsmuligheder til de forskellige møbler. Køkkenet fremstår nydeligt med hvide, stilrene fronter og god plads til madlavning.   De tre værelser har en rigtig god størrelse, og de kan derfor anvendes som soveværelser til hele familien. Dertil er der et mindre og fjerde værelse, som er oplagt at benytte til hjemmekontoret. Bryggers og badeværelser er praktiske og velholdte, og bryggerset har tilmed egen indgang.   Når sommeren står for døren, vil I automatisk trække ud i gårdhaven, som er et dejligt, ugeneret spot på matriklen med fuld sol gennem hele dagen. I kan tilgå den fra både stue og udestue, og udestuen er da også med til at forlænge sommeren på begge sider af sæsonen. Den kan åbnes helt op med skydedøre. Plænen er velholdt med hyggelig beplantning.    I bosætter jer i et roligt kvarter på Uhrhøj nær alle hverdagens gøremål. Villavejen er meget fredelig, og I kan herfra hurtigt nå både skole, pasningstilbud og indkøbsmuligheder på cykel og til fods. Der er heller ikke langt til Vejle Station og byens handelsstrøg med et alsidigt udvalg af spisesteder, kulturtilbud og shopping. Der er mulighed for tilkobling af fjernvarme, da det ligger i vejen.;7100;2010.0;;;;19.0;;;22.0;;;;;;;;;;;;;;;;;;;;;;;;;;;;;;;;;;;;;;;;;;;;;;;;;;;;;;;;;;;;;;;;;;;;;;;;;;;;;;;;;;;;;;;;;;;;;;;;;;;;;;;;;;;;;;;;;;;;;;;;;;;;;;;;;;;;;;;;;;;;;;;;;;;;;;;;;;;;;;;;;;;;;;;;;;;;;;;;;;;;;;;;;;;;;;;;;;;;;Vejle;Merkurvej 13, Uhrhøj;Merkurvej 13;Merkurvej 13 Vejle;55.663318;9.677746
