Villa;Salg;C;Naturgas;1912.0;5.0;2.0;2.0;141.0;32.0;863;1.199.000;1.909;Ribevej 13, Ødsted 7100 Vejle;Ødsted er et velfungerende lokalsamfund med et aktivt foreningsliv, et væld af fritidstilbud og alle hverdagens fornødenheder, og her ligger denne dejlige villa klar til overtagelse. Ejendommen fra 1912 er istandsat mellem 2007 og 2010 med respekt for den oprindelige stil, og i samme periode er vinduerne udskiftet til lavenergiruder. Glæd jer til tre værelser, to badeværelser, et køkken med mulighed for spiseplads, to stuer og en hyggelig have.  Boligen er 141 kvadratmeter, som fordeler sig over halvandet plan, og dertil kommer 5 kvadratmeter i kælderrummet. Børnefamilien eller parret får god plads at brede sig på, hvor de to stuer skaber optimale rammer for at samles til hyggelige stunder. Stuerne forbindes via franske døre, og her kan I nemt arrangere en spiseafdeling og et sofaafsnit.Boligen har et gennemgående trægulv på begge etager, og stueplanet afrundes af et køkken med mulighed for spiseplads, et badeværelse med bruseniche og en baggang, som kan anvendes til bryggers. Dertil kommer førstesalen, med 2 værelser, soveværelse med badeværelse samt en stor repos, der er oplagt til hjemmekontoret. Der er gulvvarme i stueplan samt begge badeværelser, dog ikke entré samt bryggers.Udendørs finder I en dejlig, stor have, der er nem at holde og anlagt med frugttræer, bærbuske, dronningebuske og syrener, der står flot i sommerhalvåret. Højbedene er fra 2021, og haven er desuden indhegnet og har et skønt, solrigt terrassemiljø. På matriklen ses også et udhus og en stor, fuldmuret garage med et vaskerum i forlængelse.  Ødsted har en rigtig god beliggenhed i Trekantområdet med optimale vejforbindelser til Vejle og Kolding, men i hverdagen behøver I ikke at bevæge jer udenfor byens grænse. I finder nemlig både skole, daginstitution, dagligvareindkøb og et væld af fritidstilbud i form af fitnessfaciliteter og padeltennis. Foreningslivet blomstrer, og der er ligeledes fine naturstier til gang, løb og cykling.;7100;;5.0;;2.0;30.0;;;;;;;;;;;;;;;;;;;;;;;;;;;;;;;;;;;;;;;;;;;;;;;;;;;;;;;;;;;;;;;;;;;;;;;;;;;;;;;;;;;;;;;;;;;;;;;;;;;;;;;;;;;;;;;;;;;;;;;;;;;;;;;;;;;;;;;;;;;;;;;;;;;;;;;;;;;;;;;;;;;;;;;;;;;;;;;;;;;;;;;;;;;;;;;;;;;;;;;;Vejle;Ribevej 13, Ødsted;Ribevej 13;Ribevej 13 Vejle;55.662697;9.405667
Villa;Salg;C;Fjernvarme;1975.0;4.0;1.0;2.0;174.0;;890;2.250.000;2.934;Niels Ebbesens Vej 5 7100 Vejle;Rammen for et skønt familieliv er sat på Niels Ebbesens Vej 5, hvor I finder denne 174 kvadratmeter store villa. Her bor I for enden af en lukket vej tæt på skoven og med stisystem til hverdagens fornødenheder. Ejendommen breder sig over halvandet plan og byder på fire værelser, et badeværelse, et toilet, et bryggers, et køkken og to opholdsstuer. Ude venter en solrig have.  Køkkenet fremstår med hvide, enkle skabselementer, og herfra er der adgang til den ene stue, hvor spisebordet kan arrangeres sammen med en blød sofa. Stuen har sydvendte vinduespartier og udgang til den overdækkede og afskærmede terrasse, der bliver skøn at opholde sig i gennem de lune måneder. Den anden stue brillerer med loft til kip, synlige bjælker, brændeovn og svalegang.  Børnefamilien vil stortrives her, for boligen rummer fire gode værelser. To ud af de tre værelser i stueplan har et walk-in-closet, og hernede finder I også badeværelset med dobbelt håndvask og bruseniche. Førstesalen rummer det fjerde værelse og et toilet, så her kan I oplagt skabe en separat forældreafdeling.  Der er gode udfoldelsesmuligheder i haven, der omkranses af en høj hæk, hvilket skærmer af. Oasen vender desuden perfekt mod øst, syd og vest, så her kan I nyde solen på alle tidspunkter af dagen. Om sommeren er det både muligt at sidde under åben himmel eller under den overdækkede del. I bosætter jer i et fredeligt kvarter med et godt naboskab og skønne, grønne stier, der leder jer trygt omkring. Der er også stisystemer til skole, daginstitution og idrætsfaciliteter, og bussen stopper få skridt fra hoveddøren. Vindinggård Center er lige i nærheden, og endelig er motorvejen let tilgængelig.;7100;;;31.0;2.0;;;;;;;;;;;;;;;;;;;;;;;;;;;;;;;;;;;;;;;;;;;;;;;;;;;;;;;;;;;;;;;;;;;;;;;;;;;;;;;;;;;;;;;;;;;;;;;;;;;;;;;;;;;;;;;;;;;;;;;;;;;;;;;;;;;;;;;;;;;;;;;;;;;;;;;;;;;;;;;;;;;;;;;;;;;;;;;;;;;;;;;;;;;;;;;;;;;;;;;;;Vejle;Niels Ebbesens Vej 5;Niels Ebbesens Vej 5;Niels Ebbesens Vej 5 Vejle;55.678127;9.550096
Villa;Salg;A2015;Fjernvarme;2018.0;5.0;2.0;2.0;166.0;56.0;1.245;4.795.000;3.603;Gimlevej 14 7100 Vejle;I kan glæde jer til at rykke jer selv, familien og flyttekasserne ind i denne skønne villa fra december 2018 på Uhrhøj. Boligen har gulvvarme overalt og byder på en veldisponeret planløsning i form af tre værelser, et kontor, to badeværelser, et bryggers og et åbent opholdsmiljø. Dertil kommer en stor, solrig have og en garage fra 2022.  Boligen har gennemgående kvalitetsmaterialer fra HTH i form af hvide, grebsfrie skabselementer i både køkken, badeværelser, walk-through-closet og bryggers. Dagslyset strømmer ind i opholdsmiljøet, og om sommeren kan I lade de tre dobbelte terrassedøre stå på vib gab, så inde og ude forenes på et splitsekund.  Planløsningen er som skræddersyet til børnefamilien med en separat forældreafdeling og et børneafsnit. Forældresoveværelset har østvendte vinduespartier og en dobbelt terrassedør, og dertil kommer et walk-through-closet og eget badeværelse. De to gode børneværelser ligger tæt på et badeværelse med kar samt et kontor og et bryggers.  Villaen er tilbagetrukket og ligger på én af de største grunde i kvarteret, hvor I får hele 1.245 kvadratmeter at boltre jer på. De to terrasser vender perfekt i forhold til solens bane, og på grunden ses også et orangeri med en udendørs brændeovn, som forlænger udendørs sæsonen.  I bosætter jer i et roligt kvarter med et godt naboskab, og herfra har I hverken langt til hverdagens fornødenheder eller naturskønne omgivelser. De mindste familiemedlemmer kan let afleveres i daginstitution til fods, mens skolebørnene trygt kan gå eller cykle til skole. I er ligeledes tæt på idrætsfaciliteter og indkøbsmuligheder, ligesom I har nem adgang til skoven og centrum.;7100;;;;1.0;;;;;;;18.0;;;;;;;;;;;;;;;;;;;;;;;;;;;;;;;;;;;;;;;;;;;;;;;;;;;;;;;;;;;;;;;;;;;;;;;;;;;;;;;;;;;;;;;;;;;;;;;;;;;;;;;;;;;;;;;;;;;;;;;;;;;;;;;;;;;;;;;;;;;;;;;;;;;;;;;;;;;;;;;;;;;;;;;;;;;;;;;;;;;;;;;;;;;;;;;;;;Vejle;Gimlevej 14;Gimlevej 14;Gimlevej 14 Vejle;55.725135;9.504517
Villa;Salg;C;Fjernvarme;1950.0;5.0;2.0;2.0;165.0;13.0;687;3.995.000;3.208;Parallelvej 5, Mølholm 7100 Vejle;I et attraktivt og eftertraget kvarter i Mølholm kan familien nu finde sig godt til rette i denne dejlige villa. Boligen har fjernvarme, og indenfor fordeler 165 kvadratmeter over sig halvandet plan, og dertil kommer yderligere 35 bonuskvadratmeter i kælderen. Glæd jer blandt andet til tre værelser, to badeværelser, et spisekøkken og to stuer. Ude venter jer en hyggelig og solrig have.Der hersker en fantastisk atmosfære i hjemmet med køkken og stue side om side, hvor det er let at være sammen på tværs af aktiviteter. Køkkenet fremstår med hvide, enkle skabselementer, og for enden af rummet arrangeres en spiseplads. Stuen modtager et generøst lysindfald gennem de sydvestvendte vinduespartier, og herfra træder I ud på terrassen i sommerhalvåret. Pejsestuen på første sal er endnu et samlingspunkt.  Stueplan afrundes af et værelse og et badeværelse, mens der på første sal venter yderligere to værelser og et badeværelse. Med to separate afsnit kan I med fordel indrette jer med en adskilt forældreafdeling. Planløsningen fuldendes af kælderen med et bryggers, tre disponible rum og direkte forbindelse til garagen.  Gennem de lune måneder kan I indtage den store, sydvestvendte terrasse og nyde tilværelsen under solens stråler med venner og familie. Oasen omkranses af flot, opvokset beplantning, hvilket skærmer af, og her er god plads til både afslapning og leg.  Den højtliggende beliggenhed i det eftertragtede kvarter er helt i top. Adressen bringer jer utrolig tæt på centrum, mens skoven med gode gåruter og mountainbikestier er lige i nærheden. Hverdagen går op i en højere enhed, da I får kort afstand til indkøb, skole, daginstitution og idrætsfaciliteter.I kan flytte ind i boligen som den er, eller ændre den og få alle jeres boligdrømme opfyldt;7100;1973.0;35.0;;3.0;;;;;;;;;;;;;;;;;;;;;;;;;;;;;;;;;;;;;;;;;;;;;;;;;;;;;;;;;;;;;;;;;;;;;;;;;;;;;;;;;;;;;;;;;;;;;;;;;;;;;;;;;;;;;;;;;;;;;;;;;;;;;;;;;;;;;;;;;;;;;;;;;;;;;;;;;;;;;;;;;;;;;;;;;;;;;;;;;;;;;;;;;;;;;;;;;;;;;;;;;Vejle;Parallelvej 5, Mølholm;Parallelvej 5;Parallelvej 5 Vejle;55.69772;9.543002
Villa;Salg;G;Oliefyr;1872.0;4.0;1.0;2.0;197.0;;694;895.000;2.361;Nørre Bygade 3, Grejs 7100 Vejle;På en central beliggenhed i Grejs finder I denne villa hvor I enten kan vælge at totalrenovere eller hvor I kan bygge nyt på grunden.Ude venter en have med enkel beplantning. Adressen er noget nær perfekt med under én kilometer til daginstitution, skole og stoppestedet, hvorfra bybussen let fragter jer til Vejle og alle byens muligheder. Ligeledes bor I nær de natursmukke skovområder ved Grejsdalen, hvis flotte rammer inviterer til udeaktiviteter for både børn og voksne året rundt. En yderligere force er, at I hurtigt når motorvejstilkørslen. Ejendommen er opført i 1872 med 197 m2, som fordeler sig over halvandet plan. I træder ind i baggangen, hvor døren leder jer ind i det ældre køkken med retro stil i forlængelse af alrum med spiseplads. Den store stue kan let indrettes med behagelige møbler, et aflangt middagsbord eller et kontorafsnit alt efter jeres behov. Stueplanet afrundes af et badeværelse med bruseafsnit samt en entré og et bryggers. På første sal giver reposen adgang til tre værelser. Det ene værelse har en sydvendt altan. Gennem den luneårstid kan I nyde tilværelsen på den vestvendte terrasse i selskab med familie og venner. Er I interesserede i flere oplysninger? Kontakt os allerede i dag på tlf. 75724444.;7100;;17.0;;2.0;17.0;;;;;;;;;;;;;;;;;;;;;;;;;;;;;;;;;;;;;;;;;;;;;;;;;;;;;;;;;;;;;;;;;;;;;;;;;;;;;;;;;;;;;;;;;;;;;;;;;;;;;;;;;;;;;;;;;;;;;;;;;;;;;;;;;;;;;;;;;;;;;;;;;;;;;;;;;;;;;;;;;;;;;;;;;;;;;;;;;;;;;;;;;;;;;;;;;;;;;;;;Vejle;Nørre Bygade 3, Grejs;Nørre Bygade 3;Nørre Bygade 3 Vejle;55.761408;9.542263
Villa;Salg;D;Fjernvarme;1912.0;4.0;1.0;2.0;117.0;;273;1.795.000;2.219;Skovvejen 20, Grejsdalen 7100 Vejle;Ned ad en lille, stilfærdig grusvej i Grejsdalen dukker denne charmerende ejendom op på 167 etagemeter. Huset ved navn Lillebo er opført i 1912, og her kan I bruge de eksisterende rammer til at skabe en skøn kombination af ejendommens sjæl blandet med moderne stil og komfort. Glæd jer blandt andet til tre værelser, en stor stue og en dejlig naturudsigt.  Ejendommen er spækket med et væld af originale detaljer, se eksempelvis trægulvene og fyldningsdørene, hvilket understreger den helt særlige atmosfære. I har således ideelle betingelser for at forene nyt med gammelt, hvis I vælger at slippe boligdrømmene løs og sætte jeres eget præg.  Foruden en entré er hele stueplanet dedikeret til opholdsrum i form af køkkenet og stuen. Ved at lave en åbning mellem de to rum, kan I skabe ét stort leverum, hvor I kan nyde hinandens selskab på tværs af aktiviteter. På 1.salen finder i tre gode værelser samt et badeværelse. I kælderen er der tre disp. rum samt toilet, bryggers og teknik rum.  Ejendommen ligger på en skrånende grund, og fra kælderen har I således direkte udgang til haven. Her finder I en dejlig terrasse, hvor I kan dase under solens stråler, mens oasen også byder på et hyggeligt bålsted samt flere bærbuske og frugttræer, hvor skovens rådyr af og til lægger vejen forbi og spiser af æblerne.  Med denne adressen får I det bedste fra to verdener, da I bosætter jer meget idyllisk mellem skov og by. Skoven ligger lige rundt om hjørnet, og skal I ind til midtbyens mange muligheder, kan I gå dertil på kort tid. I hverdagen har I ligeledes kort afstand til skole, pasningstilbud og indkøbsmuligheder.;7100;;50.0;;3.0;;;;;;;;;;;;;;;;;;;;;;;;;;;;;;;;;;;;;;;;;;;;;;;;;;;;;;;;;;;;;;;;;;;;;;;;;;;;;;;;;;;;;;;;;;;;;;;;;;;;;;;;;;;;;;;;;;;;;;;;;;;;;;;;;;;;;;;;;;;;;;;;;;;;;;;;;;;;;;;;;;;;;;;;;;;;;;;;;;;;;;;;;;;;;;;;;;;;;;;;;Vejle;Skovvejen 20, Grejsdalen;Skovvejen 20;Skovvejen 20 Vejle;55.719987;9.532375
Villa;Salg;D;Oliefyr;1979.0;4.0;2.0;3.0;189.0;;4.623;;;Sindballevej 16+18, Lindved 7100 Vejle;Med nøgleord som flot istandsat, lækre materialer og et stort terrasseområde med pool får I gode rammer i denne indbydende villa i Lindved. Her venter tre værelser, to badeværelser, et stort opholdsmiljø og en særdeles brugbar underetage, der tilsammen sikrer jer både privatliv og samvær. Oveni har boligen gennemgået en løbende renovering siden 2015. Endelig får I en god beliggenhed nær hverdagens gøremål.  Samlingspunktet bliver det store opholdsmiljø med åben forbindelse mellem stuen og køkken/alrummet, som giver jer mulighed for at prioritere samvær på tværs af madlavning og hverdagens gøremål. Tilmed er der en hyggelig pejseindsats, og på solskinsdage kan I åbne døren til terrassen, som på harmonisk vis forener inde og ude. Desuden fremtræder køkkenet stilrent med hvide højglanselementer i flot kontrast til de sorte bordplader.  Glæd jer til et skønt forældresoveværelse med et walk-in-closet og eget badeværelse, som er særligt lækkert med både et badekar, en bruseniche og en dobbelthåndvask. Videre er der to værelser med mange muligheder, hvad end I ønsker børneværelser, kontor eller hobbyrum. I kælderen er der to disp. rum samt badeværelse.  Den dejlige grund bliver et forrygende supplement til boligen. Her er et stort terrasseområde, der indbyder til frokost under åben himmel, mens den lækre swimmingpool inviterer til friske dukkerter.Som bonus er der en bygning med værksted, lager, kontor og toilet, ligesom der en carport med skur. Der medfølger en ekstra grund ved siden af - Sindballevej 18.I bosætter jer i en hyggelig by, hvor I kan glæde jer over kort afstand til bus, indkøb, skole og daginstitution. Desuden er der mulighed for fysiske udfoldelser i sportshallen. Endelig giver bilen jer nem adgang til både Vejle, Hedensted og Horsens.;7100;;41.0;30.0;2.0;;;;;;;;235.0;36.0;;;;;;;;;;;;;;;;;;;;;;;;;;;;;;;;;;;;;;;;;;;;;;;;;;;;;;;;;;;;;;;;;;;;;;;;;;;;;;;;;;;;;;;;;;;;;;;;;;;;;;;;;;;;;;;;;;;;;;;;;;;;;;;;;;;;;;;;;;;;;;;;;;;;;;;;;;;;;;;;;;;;;;;;;;;;;;;;;;;;;;;;;;;;;;;;Vejle;Sindballevej 16+18, Lindved;Sindballevej 16+18;Sindballevej 16+18 Vejle;;
Villa;Salg;E;Naturgas;1977.0;5.0;2.0;2.0;136.0;28.0;1.038;;;Engtoftevej 8, Lindved 7100 Vejle;Ønsker I at bo i et trygt villakvarter nær alle hverdagens fornødenheder, er denne fine etplansvilla i Lindved noget for jer. Her får I rum til hele familien, da planløsningen fordeler sig over tre værelser, en stor stue, et køkken, et bryggers, et gæstetoilet og et badeværelse. Dertil kommer den hyggelige lukkede terrasse og den velanlagte have med køkkenhave og masser af plads til leg.  I den rummelige og lyse stue får I flere indretningsmuligheder, da der både kan installeres sofahjørne og et formelt langbord til diverse festlige arrangementer. Køkkenet ligger hertil i åben forbindelse og fremstår både nydeligt og funktionelt, ligesom I snildt kan arrangere en mindre spisesektion, hvor I kan samles hele familien.  Værelserne findes i fordelingsgangen og byder alle tre på lyse og behagelige rammer, hvor I kan gå til ro for natten. To af dem udgør de perfekte børneværelser, mens det sidste er ideelt som forældresoveværelse.  Nyd sommeren i haven og på de forskellige terrasser, der forsyner jer med sol i løbet af hele dagen. Børnene vil elske at lege på det grønne græs, mens I kan gå i den frodige køkkenhave, hvor I bliver selvforsynende med flere forskellige grøntsager og frugter.  I bosætter jer på en stille og rolig villavej, der er et utrolig trygt sted at slå sig ned som familie. Fra adressen får I let til dagligdagens gøremål, da der er meget kort afstand til både indkøbsmuligheder, skole og daginstitutioner, ligesom byens idrætsfaciliteter også blot er en lille cykeltur fra hoveddøren.;7100;;;;1.0;;;;;;;;;;;;;;;;;;;;;;;;;;;;;;;;;;;;;;;;;;;;;;;;;;;;;;;;;;;;;;;;;;;;;;;;;;;;;;;;;;;;;;;;;;;;;;;;;;;;;;;;;;;;;;;;;;;;;;;;;;;;;;;;;;;;;;;;;;;;;;;;;;;;;;;;;;;;;;;;;;;;;;;;;;;;;;;;;;;;;;;;;;;;;;;;;;;;;;;;;Vejle;Engtoftevej 8, Lindved;Engtoftevej 8;Engtoftevej 8 Vejle;55.796018;9.576595
Villa;Salg;C;Fjernvarme;1952.0;4.0;1.0;2.0;116.0;;734;3.295.000;3.388;Stønnekærvej 2, Mølholm 7100 Vejle;Med nøgleord som naturskønne omgivelser, lækkert lysindfald og flot istandsat villa får I her gode rammer i Mølholm på 232 etagemeter. I 2021-2022 har villaen gennemgået en større renovering med nyere tag, aluminiums-tagrender, badeværelse, toilet, el og VVS. Indenfor venter tre værelser, et stort opholdsmiljø og en brugbar underetage, som sikrer jer både privatliv og samvær.   Trumfkortet er det store opholdsmiljø med delvis åben forbindelse mellem stue og køkken/alrum, som giver mulighed for at prioritere familiens samvær på tværs af madlavning og hverdagens gøremål. Oveni er der udgang til altanen, som på harmonisk vis forener inde og ude. Køkkenet fremstår stilrent med hvide elementer i flot kontrast til de sorte bordplader. Tilmed er der ovenlysvinduer, som sikrer et fantastisk lysindfald.  Etagen rummer også tre værelser, hvor I udover et soveværelse kan indrette jer med enten børneværelser, et kontor eller et hobbyrum. Videre er der et badeværelse og et gæstetoilet, som begge har naturfliser fra Haubjerg Madsen. Desuden er det værd at bemærke, at der både er gulvvarme i badeværelset, toilettet, stuen og køkken/alrummet.  Boligen fuldendes af en dejlig have, som bliver det naturlige omdrejningspunkt i sommerhalvåret. Her er en hyggekrog med plads til et cafésæt og en skøn altan, der indbyder til frokost under åben himmel, mens den overdækkede terrasse gør det muligt at nyde udelivet i læ for sol og regn. Som bonus er der en stor garage med elport og et lækkert lysindfald.  Beliggenheden forener på bedste vis nærheden til hverdagens gøremål og grønne områder. I får kort gåafstand til Vindinggård Center, bus, skole, daginstitution og sportsfaciliteter, ligesom I kan glæde jer over områdets trygge stisystem. Hvis I har lyst til naturskønne gåture, kan I følge stierne gennem den nærliggende skov til Ibæk Strandvej og Vejle Fjord. Endelig er Vejle Station, Bryggen og centrum en kort cykeltur væk.;7100;2022.0;116.0;;2.0;;;;;;;;;;;;;;;;;;;;;;;;;;;;;;;;;;;;;;;;;;;;;;;;;;;;;;;;;;;;;;;;;;;;;;;;;;;;;;;;;;;;;;;;;;;;;;;;;;;;;;;;;;;;;;;;;;;;;;;;;;;;;;;;;;;;;;;;;;;;;;;;;;;;;;;;;;;;;;;;;;;;;;;;;;;;;;;;;;;;;;;;;;;;;;;;;;;;;;;;;Vejle;Stønnekærvej 2, Mølholm;Stønnekærvej 2;Stønnekærvej 2 Vejle;55.687595;9.562469
Villa;Salg;E;Elvarme;1992.0;4.0;1.0;1.0;112.0;;712;1.299.000;1.776;Holtumvej 56, Holtum 7100 Vejle;Denne fine villa ligger i Holtum nær Jelling, Tørring, Vejle og Hedensted. Her får I naturskønne omgivelser, mens boligen råder over en god planløsning foruden udsigt til nabogrundens fine sø. Der venter indenfor et køkken i forbindelse med stuen, tre værelser, et badeværelse og et bryggers. Dertil er der en dobbelt carport med tilhørende stort redskabsskur samt en hyggelig have. I bosætter jer i fredelige og naturskønne omgivelser i Holtum, og herfra er der kun 13 kilometers køretur til Bryggen i Vejle. I er samtidig tæt på flere nabobyers tilbud, såsom Lindved, der har både skole og institution, og kun ligger cirka et kvarters cykeltur væk. Der går også en skolebus, som kan fragte de mindste børn afsted om morgenen. I har også mulighed for at sende børnene i skole i Jelling eller i Grejs. Dagligstuen ligger i åben forbindelse med køkkenet, hvilket gør det nemt for jer at tilbringe tid sammen på tværs af forskellige aktiviteter. Der falder endvidere et meget behageligt lysindfald ind gennem det store vinduesparti, som skaber en rar atmosfære, og så får I god plads til både det komfortable sofahjørne og et spiseareal. Huset har tre værelser, som alle er i gode størrelser, og I kan derfor fordele dem mellem både store og små.;7100;;;52.0;1.0;;;;;;;;;;;;;;;;;;;;;;;;;;;;;;;;;;;;;;;;;;;;;;;;;;;;;;;;;;;;;;;;;;;;;;;;;;;;;;;;;;;;;;;;;;;;;;;;;;;;;;;;;;;;;;;;;;;;;;;;;;;;;;;;;;;;;;;;;;;;;;;;;;;;;;;;;;;;;;;;;;;;;;;;;;;;;;;;;;;;;;;;;;;;;;;;;;;;;;;;;Vejle;Holtumvej 56, Holtum;Holtumvej 56;Holtumvej 56 Vejle;55.786021;9.518567
Villa;Salg;C;Fjernvarme/blokvarme;1963.0;4.0;1.0;1.0;120.0;20.0;892;1.895.000;2.177;Lykkevænget 1, Bramdrupdam 6000 Kolding;Velkommen til villaen på Lykkevænget, der fra 2019 er sat løbende i stand. I ét plan får I et køkken i åben forbindelse til en stue samt en havestue, et badeværelse, tre værelser og et bryggers. De mange forbedringer består blandt andet af fjernvarmeanlæg fra 2018, energiisolering i 2022, eltavle fra 2019 og separat kloakering fra 2021. Haven er særlig dejlig med flere terrassemiljøer.;7100;;;;1.0;;;;;;;;;;;;;;;;;;;;;;;;;;;;;;;;;;;;;;;;;;;;;;;;;;;;;;;;;;;;;;;;;;;;;;;;;;;;;;;;;;;;;;;;;;;;;;;;;;;;;;;;;;;;;;;;;;;;;;;;;;;;;;;;;;;;;;;;;;;;;;;;;;;;;;;;;;;;;;;;;;;;;;;;;;;;;;;;;;;;;;;;;;;;;;;;;;;;;;;;;Kolding;Lykkevænget 1, Bramdrupdam;Lykkevænget 1;Lykkevænget 1 Kolding;55.522499;9.452838
Villa;Salg;C;Fjernvarme/blokvarme;1986.0;5.0;1.0;2.0;192.0;82.0;1.035;6.850.000;4.594;Harevænget 67, Strandhuse 6000 Kolding;Harevænget 67 i Strandhuse er til den kræsne køber, der vil elske den moderne elegance på tværs af tre etager. Her får man foruden et væld af værelser også nogle charmerende opholdsrum, og hele herligheden blev desuden ombygget i 2007 med delikate detaljer såsom Genvex-anlæg i alle rum. Sælger har punget ud for at få installeret ladestandere til elbilerne.;6000;2007.0;94.0;22.0;3.0;16.0;;;;;;;;;;;;;;;;;;;;;;;;;;;;;;;;;;;;;;;;;;;;;;;;;;;;;;;;;;;;;;;;;;;;;;;;;;;;;;;;;;;;;;;;;;;;;;;;;;;;;;;;;;;;;;;;;;;;;;;;;;;;;;;;;;;;;;;;;;;;;;;;;;;;;;;;;;;;;;;;;;;;;;;;;;;;;;;;;;;;;;;;;;;;;;;;;;;;;;;;Kolding;Harevænget 67, Strandhuse;Harevænget 67;Harevænget 67 Kolding;55.499088;9.546194
Villa;Salg;C;Fjernvarme/blokvarme;1878.0;5.0;1.0;2.0;122.0;24.0;508;3.745.000;2.776;Lindbæksvej 1, Strandhuse 6000 Kolding;Med nøgleord som fuldstændig indflytningsklar, flot istandsat, en smuk fjordudsigt og nem adgang til vandet får I gode rammer i denne villa i Strandhuse. Villaen fra 1878 er løbende vedligeholdt og er totalrenoveret i 2008 med gulvvarme i hele stueplan og respekt for den oprindelige historie og sjæl, så de 122 kvadratmeter er indflytningsklare. Oveni har bryggerset og gæstetoilettet fået udskiftet inventar i 2019. Endelig får I en pragtfuld have hvorfra i også har udsigt fra de to terrasser.;6000;1990.0;;;2.0;;;;;;;;;;;;;;;;;;;;;;;;;;;;;;;;;;;;;;;;;;;;;;;;;;;;;;;;;;;;;;;;;;;;;;;;;;;;;;;;;;;;;;;;;;;;;;;;;;;;;;;;;;;;;;;;;;;;;;;;;;;;;;;;;;;;;;;;;;;;;;;;;;;;;;;;;;;;;;;;;;;;;;;;;;;;;;;;;;;;;;;;;;;;;;;;;;;;;;;;;Kolding;Lindbæksvej 1, Strandhuse;Lindbæksvej 1;Lindbæksvej 1 Kolding;55.498997;9.520694
Villa;Salg;D;Fjernvarme/blokvarme;1976.0;4.0;2.0;2.0;160.0;;899;6.495.000;3.451;Troensevej 10 6000 Kolding;På Troensevej 10 i det attraktive Strandhuse i Kolding finder I denne stilrene villa, der passer perfekt til børnefamilien. Den funktionelle planløsning giver jer optimale indretningsmuligheder, og de moderne, gennemgående rammer skaber en flot, rød tråd. Der er ligeså indbydende rammer udendørs, hvor I får en skøn udsigt og privatliv på de solrige terrassemiljøer. Hertil er der nem adgang til vandet og alle hverdagens fornødenheder.;6000;2008.0;87.0;;2.0;;;;;;;;;;;;;;;;;;;;;;;;;;;;;;;;;;;;;;;;;;;;;;;;;;;;;;;;;;;;;;;;;;;;;;;;;;;;;;;;;;;;;;;;;;;;;;;;;;;;;;;;;;;;;;;;;;;;;;;;;;;;;;;;;;;;;;;;;;;;;;;;;;;;;;;;;;;;;;;;;;;;;;;;;;;;;;;;;;;;;;;;;;;;;;;;;;;;;;;;;Kolding;Troensevej 10;Troensevej 10;Troensevej 10 Kolding;55.501758;9.509853
Villa;Salg;G;Centralvarme med én fyringsenhed;1880.0;3.0;1.0;1.0;104.0;26.0;911;995.000;2.179;Seest Bakke 48 6000 Kolding;På Seest Bakke 48 står dette ældre, hvide hus fra 1880, som bærer tydeligt præg af sin alder. Ejendommen har derfor behov for enten en omfattende gennemrenovering eller nedrivning. Den gode placering i Seest ved Kolding gør det dog til en attraktiv mulighed med en fin grund, hvor I kan skabe et helt nyt hjem fra bunden.;6000;;;;1.0;;;;;;;;;;;;;;;;;;;;;;;;;;;;;;;;;;;;;;;;;;;;;;;;;;;;;;;;;;;;;;;;;;;;;;;;;;;;;;;;;;;;;;;;;;;;;;;;;;;;;;;;;;;;;;;;;;;;;;;;;;;;;;;;;;;;;;;;;;;;;;;;;;;;;;;;;;;;;;;;;;;;;;;;;;;;;;;;;;;;;;;;;;;;;;;;;;;;;;;;;Kolding;Seest Bakke 48;Seest Bakke 48;Seest Bakke 48 Kolding;55.487852;9.455077
Villa;Salg;E;Fjernvarme/blokvarme;1967.0;3.0;1.0;2.0;125.0;24.0;542;;;Fasanvej 9 6000 Kolding;Velkommen til Fasanvej 9 i Kolding, hvor I nu skal se en pæn villa fra 1967. I ét plan råder hjemmet over en stor vinkelstue, et køkken, to værelser, et badeværelse, et gæstetoilet og et bryggers. Haven tilbyder et naturskønt uderum med en opvokset beplantning, en terrasse og hertil kommer en carport med et tilstødende skur.;6000;;;;1.0;;;;;;;;;;;;;;;;;;;;;;;;;;;;;;;;;;;;;;;;;;;;;;;;;;;;;;;;;;;;;;;;;;;;;;;;;;;;;;;;;;;;;;;;;;;;;;;;;;;;;;;;;;;;;;;;;;;;;;;;;;;;;;;;;;;;;;;;;;;;;;;;;;;;;;;;;;;;;;;;;;;;;;;;;;;;;;;;;;;;;;;;;;;;;;;;;;;;;;;;;Kolding;Fasanvej 9;Fasanvej 9;Fasanvej 9 Kolding;55.498287;9.465633
